<?xml version="1.0" encoding="UTF-8"?>
<p:cvi xmlns:p="http://univ.fr/cvi" xmlns:xsi="http://www.w3.org/2001/XMLSchema-instance" xsi:schemaLocation="http://univ.fr/cvi tp1.cvi.01.xsd ">
  <p:identite>
    <nom>NOM</nom>
    <prenom>Prenom</prenom>
  </p:identite>
  <p:objectif>
    <stage>Stage</stage>
  </p:objectif>
  <p:prof>
  	<p:expe>
  		<datedeb>12-02-2008</datedeb>
  		<datefin>24-11-2011</datefin>
  		<descript>Une première expérience</descript>
  	</p:expe>
  </p:prof>
  <p:competences>
  	<p:diplome niveau="III">
  		<date>23-05-2012</date>
  		<descript>Baccalauréat S</descript>
  		<institut>Lycée Corneille</institut>
  	</p:diplome>
    <p:lv/>
  </p:competences>
  <p:divers>pdivers</p:divers>
</p:cvi>
